key,description
API_ACCOUNTS.ACC_SETTL_AMT_PD,ACC_SETTL_AMT_PD Total amount paid by the customer and allocated to account balances between effective date and Good through date
API_ACCOUNTS.ACC_SETTL_EXPIRY_DT,ACC_SETTL_EXPIRY_DT Settlement agreement end date
API_ACCOUNTS.ACC_SETTL_START_DT,ACC_SETTL_START_DT Settlement agreement start date
API_ACCOUNTS.ACC_STMT_PREFERENCE_MODE_CD,ACC_STMT_PREFERENCE_MODE_CD Account Statement Preference Mode code
API_ACCOUNTS.CREATED_BY,CREATED_BY Standard Who
API_ACCOUNTS.CREATION_DATE,CREATION_DATE Standard Who
API_ACCOUNTS.ACC_ALLOW_REPO_ON_SCRA_IND,ACC_ALLOW_REPO_ON_SCRA_IND Indicator to state if SCRA is allowed on Reposession
API_ACCOUNT_BALANCES.ABL_BAL_ABL,ABL_BAL_ABL Accumulated Average daily balance for advance balance type
API_ACCOUNT_BALANCES.ABL_APP_ORIG_SYS_XREF,ABL_APP_ORIG_SYS_XREF External Reference Number
API_ACCOUNT_BALANCES.CREATED_BY,CREATED_BY Standard Who
API_ACCOUNT_BALANCES.CREATION_DATE,CREATION_DATE Standard Who
API_ACCOUNT_BALANCES.ABL_DT,ABL_DT Effective date of the balance
API_ACCOUNT_BALANCES.ABL_PROM_TYPE_CD,ABL_PROM_TYPE_CD Reference key to lookup promotion type
API_ACCOUNT_BALANCES.ABL_RATE,ABL_RATE Interest rate during the promotional period
API_ACCOUNT_BALANCES.ABL_TERM,ABL_TERM Promotional term or period
API_ACCOUNT_BALANCES.ABL_PRM_END_DT,ABL_PRM_END_DT Promotion balance end date
API_ACCOUNT_BALANCES.ABL_DUE_AMT1,ABL_DUE_AMT1 Due amount 1 cycle old
API_ACCOUNT_BALANCES.ABL_DUE_AMT2,ABL_DUE_AMT2 Due amount 2 cycle old
API_ACCOUNT_BALANCES.ABL_DUE_AMT3,ABL_DUE_AMT3 Due amount 3 cycle old
API_ACCOUNT_BALANCES.ABL_DUE_AMT4,ABL_DUE_AMT4 Due amount 4 cycle old
API_ACCOUNT_BALANCES.ABL_DUE_AMT5,ABL_DUE_AMT5 Due amount 5 cycle old
API_ACCOUNT_BALANCES.ABL_DUE_AMT_PD1,ABL_DUE_AMT_PD1 Due amount 1 cycle old paid
API_ACCOUNT_BALANCES.ABL_DUE_AMT_PD2,ABL_DUE_AMT_PD2 Due amount 2 cycle old paid
API_ACCOUNT_BALANCES.ABL_DUE_AMT_PD3,ABL_DUE_AMT_PD3 Due amount 3 cycle old paid
API_ACCOUNT_BALANCES.ABL_DUE_AMT_PD4,ABL_DUE_AMT_PD4 Due amount 4 cycle old paid
API_ACCOUNT_BALANCES.ABL_DUE_AMT_PD5,ABL_DUE_AMT_PD5 Due amount 5 cycle old paid
API_ACCOUNT_BALANCES.ABL_PIN_CODE,ABL_PIN_CODE Reference Key to Product Insurances
API_ACCOUNT_BALANCES.ABL_INS_SUB_TYPE_CD,ABL_INS_SUB_TYPE_CD The credit insurance sub type code
API_ACCOUNT_BALANCES.ABL_INS_STATUS_CD,ABL_INS_STATUS_CD The credit insurance status code such as active
API_ACCOUNT_BALANCES.ABL_BAL_TERMINATE,ABL_BAL_TERMINATE Terminated Balance (ITD)
API_ACCOUNT_BALANCES.ABL_BAL_TERMINATE_CTD,ABL_BAL_TERMINATE_CTD Terminated balance (CTD) for the current cycle
API_ACCOUNT_BALANCES.ABL_BAL_TERMINATE_YTD,ABL_BAL_TERMINATE_YTD Terminated balance (YTD) for the current year
API_ACCOUNT_BALANCES.ABL_BAL_TERMINATE_CTD1,ABL_BAL_TERMINATE_CTD1 Terminated balance (CTD) for the previous cycle
API_ACCOUNT_BALANCES.ABL_BAL_TERMINATE_YTD1,ABL_BAL_TERMINATE_YTD1 Terminated balance (YTD) for the previous year
API_ACCOUNT_BALANCES.ABL_TERMINATE_IND,ABL_TERMINATE_IND Indicates whether balance is terminatable
API_ACCOUNT_BALANCES.ABL_BAL_ABL_CTD1,ABL_BAL_ABL_CTD1 Accumulated Average daily balance for advance balance type for previous cycle one
API_ACCOUNT_BALANCES.ABL_BAL_ABL_CTD2,ABL_BAL_ABL_CTD2 Accumulated Average daily balance for advance balance type for previous cycle two
API_ACCOUNT_BALANCES.ABL_BAL_ABL_CTD3,ABL_BAL_ABL_CTD3 Accumulated Average daily balance for advance balance type for previous cycle three
API_ACCOUNT_BALANCES.ABL_BAL_ABL_CTD4,ABL_BAL_ABL_CTD4 Accumulated Average daily balance for advance balance type for previous cycle four
API_ACCOUNT_BALANCES.ABL_BAL_ABL_CTD5,ABL_BAL_ABL_CTD5 Accumulated Average daily balance for advance balance type for previous cycle five
API_ACCOUNT_BALANCES.ABL_NON_PERFORM_ROLL_IND,ABL_NON_PERFORM_ROLL_IND Indicates whether balance can be rolled
API_ACCOUNT_BALANCES.ABL_NON_PERFORM_TXN_TYPE_CD,ABL_NON_PERFORM_TXN_TYPE_CD Balance type where non-performing balance rolled into
API_ACCOUNT_BALANCES.ABL_BAL_XFER2NON_PERFORM,ABL_BAL_XFER2NON_PERFORM Amount was due for the balance type  when account went into non-performance state
API_ACCOUNT_BALANCES.ABL_BAL_PD_XFER2NON_PERFORM,ABL_BAL_PD_XFER2NON_PERFORM Amount was paid for the balance type  when account went into non-performance state
API_ACCOUNT_BALANCES.ABL_NON_PERFORM_BAL,ABL_NON_PERFORM_BAL Non performing balance
API_ACCOUNT_BALANCES.ABL_NON_PERFORM_BAL_PD,ABL_NON_PERFORM_BAL_PD Amount paid against non-performing balance
API_ACCOUNT_BALANCES.ABL_NON_PERFORM_BAL_PD_EXCESS,ABL_NON_PERFORM_BAL_PD_EXCESS Amount paid excess to non-performing balance
API_ACCOUNT_BALANCES.ABL_NON_PERFORM_BAL_WAIVED,ABL_NON_PERFORM_BAL_WAIVED Waived non-performing balance
API_ACCOUNT_BALANCES.ABL_NON_PERFORM_BAL_ADJ_PLUS,ABL_NON_PERFORM_BAL_ADJ_PLUS Positive adjustments to non-performing balance
API_ACCOUNT_BALANCES.ABL_NON_PERFORM_BAL_ADJ_MINUS,ABL_NON_PERFORM_BAL_ADJ_MINUS Negative adjustments to non-performing balance
API_ACCOUNT_BALANCES.ABL_BAL_BILLED,ABL_BAL_BILLED Billed balance
API_ACCOUNT_BALANCES.ABL_BAL_BILLED_CTD,ABL_BAL_BILLED_CTD Billed balance (CTD) for the current year
API_ACCOUNT_BALANCES.ABL_BAL_BILLED_CTD1,ABL_BAL_BILLED_CTD1 Billed balance (CTD) for the previous year
API_ACCOUNT_BALANCES.ABL_BAL_BILLED_YTD,ABL_BAL_BILLED_YTD Billed balance (YTD) for the current year
API_ACCOUNT_BALANCES.ABL_RATE_EFFECTIVE,ABL_RATE_EFFECTIVE Stores the current effective rate
API_ACCOUNT_BALANCES.ABL_CPT_IND,ABL_CPT_IND Indicates whether the account is enabled for capitalized or not
API_ACCOUNT_BALANCES.ABL_CPT_FREQUENCY_CD,ABL_CPT_FREQUENCY_CD Capitalization Frequency
API_ACCOUNT_BALANCES.ABL_CPT_GRACE_DAYS,ABL_CPT_GRACE_DAYS Grace days provided before executing the Capitalization
API_ACCOUNT_BALANCES.ABL_CPT_RUN_DT_NEXT,ABL_CPT_RUN_DT_NEXT Account Balances Capitalization next Run Date
API_ACCOUNT_BALANCES.ABL_BAL_CPT_PLUS,ABL_BAL_CPT_PLUS Positive adjustments to balance type (CPT) Capitalization
API_ACCOUNT_BALANCES.ABL_BAL_CPT_MINUS,ABL_BAL_CPT_MINUS Negative adjustments to balance type (CPT) Capitalization
API_ACCOUNT_BALANCES.ABL_BAL_CPT_PLUS_CTD,ABL_BAL_CPT_PLUS_CTD Current to date Adjusted Plus Balance
API_ACCOUNT_BALANCES.ABL_BAL_CPT_MINUS_CTD,ABL_BAL_CPT_MINUS_CTD Current to date Adjusted Minus Balance
API_ACCOUNT_BALANCES.ABL_BAL_CPT_PLUS_YTD,ABL_BAL_CPT_PLUS_YTD Positive adjustment balance (YTD) for the current year
API_ACCOUNT_BALANCES.ABL_BAL_CPT_MINUS_YTD,ABL_BAL_CPT_MINUS_YTD Negative adjustment balance (YTD) for the current year
API_ACCOUNT_BALANCES.ABL_TXN_TYPE_CD,ABL_TXN_TYPE_CD Reference key to lookup transaction type or balance type
API_ACCOUNT_BALANCES.ABL_PRM_CODE,ABL_PRM_CODE Reference key to promotion
API_ACCOUNT_BALANCES.ABL_BAL_SORT,ABL_BAL_SORT Sort
API_ACCOUNT_BALANCES.ABL_BAL,ABL_BAL Current posted balance(Advance/Interest/Fee/Expense/Insurance)
API_ACCOUNT_BALANCES.ABL_BAL_PD,ABL_BAL_PD Balance paid (ITD)
API_ACCOUNT_BALANCES.ABL_BAL_WAIVED,ABL_BAL_WAIVED Balance waived (ITD)
API_ACCOUNT_BALANCES.ABL_BAL_CHGOFF,ABL_BAL_CHGOFF Charged off balance (ITD)
API_ACCOUNT_BALANCES.ABL_BAL_RECOVERED,ABL_BAL_RECOVERED Balance recovered (ITD)
API_ACCOUNT_BALANCES.ABL_BAL_ADJUSTED_PLUS,ABL_BAL_ADJUSTED_PLUS Positive adjustment balance (ITD)
API_ACCOUNT_BALANCES.ABL_BAL_ADJUSTED_MINUS,ABL_BAL_ADJUSTED_MINUS Negative adjustment balance (ITD)
API_ACCOUNT_BALANCES.ABL_BAL_OPEN_CTD,ABL_BAL_OPEN_CTD Opening balance (CTD) for the current cycle
API_ACCOUNT_BALANCES.ABL_BAL_CTD,ABL_BAL_CTD Posted balance (CTD) for the current cycle
API_ACCOUNT_BALANCES.ABL_BAL_PD_CTD,ABL_BAL_PD_CTD Balance paid (CTD) in the current cycle
API_ACCOUNT_BALANCES.ABL_BAL_WAIVED_CTD,ABL_BAL_WAIVED_CTD Balance waived (CTD) in the current cycle
API_ACCOUNT_BALANCES.ABL_BAL_CHGOFF_OPEN_CTD,ABL_BAL_CHGOFF_OPEN_CTD Opening Charged off balance (CTD) for the current cycle
API_ACCOUNT_BALANCES.ABL_BAL_CHGOFF_CTD,ABL_BAL_CHGOFF_CTD Charged off balance (CTD) for the current cycle
API_ACCOUNT_BALANCES.ABL_BAL_RECOVERED_CTD,ABL_BAL_RECOVERED_CTD Balance recovered (CTD) in the current year
API_ACCOUNT_BALANCES.ABL_BAL_ADJUSTED_PLUS_CTD,ABL_BAL_ADJUSTED_PLUS_CTD Positive adjustment balance (CTD) for the current cycle
API_ACCOUNT_BALANCES.ABL_BAL_ADJUSTED_MINUS_CTD,ABL_BAL_ADJUSTED_MINUS_CTD Negative adjustment balance (CTD) for the current cycle
API_ACCOUNT_BALANCES.ABL_BAL_OPEN_YTD,ABL_BAL_OPEN_YTD Opening balance (YTD) for the current year
API_ACCOUNT_BALANCES.ABL_BAL_YTD,ABL_BAL_YTD Posted balance (YTD) for the current year
API_ACCOUNT_BALANCES.ABL_BAL_PD_YTD,ABL_BAL_PD_YTD Balance paid(YTD) in the current year
API_ACCOUNT_BALANCES.ABL_BAL_WAIVED_YTD,ABL_BAL_WAIVED_YTD Balance waived (YTD) in the current year
API_ACCOUNT_BALANCES.ABL_BAL_CHGOFF_OPEN_YTD,ABL_BAL_CHGOFF_OPEN_YTD Opening Charged off balance (YTD) for the current year
API_ACCOUNT_BALANCES.ABL_BAL_CHGOFF_YTD,ABL_BAL_CHGOFF_YTD Charged off balance (YTD) for the current year
API_ACCOUNT_BALANCES.ABL_BAL_RECOVERED_YTD,ABL_BAL_RECOVERED_YTD Balance recovered (YTD) in the current year
API_ACCOUNT_BALANCES.ABL_BAL_ADJUSTED_PLUS_YTD,ABL_BAL_ADJUSTED_PLUS_YTD Positive adjustment balance (YTD) for the current year
API_ACCOUNT_BALANCES.ABL_BAL_ADJUSTED_MINUS_YTD,ABL_BAL_ADJUSTED_MINUS_YTD Negative adjustment balance (YTD) for the current year
API_ACCOUNT_BALANCES.ABL_BAL_BILLED_IND,ABL_BAL_BILLED_IND Indicates whether the balance is billable
API_ACCOUNT_BALANCES.ABL_INTEREST_ACCRUED_IND,ABL_INTEREST_ACCRUED_IND Indicates whether interest is accruable
API_ACCOUNT_BALANCES.ABL_CHARGEOFF_METHOD_CD,ABL_CHARGEOFF_METHOD_CD Reference key to lookup chargeoff method
API_ACCOUNT_BALANCES.ABL_RESCHEDULE_METHOD_CD,ABL_RESCHEDULE_METHOD_CD Reference key to lookup reschedule method
API_ACCOUNT_BALANCES.ABL_WRITEOFF_METHOD_CD,ABL_WRITEOFF_METHOD_CD Reference key to lookup writeoff method
API_ACCOUNT_BALANCES.ABL_BAL_OPEN_CTD1,ABL_BAL_OPEN_CTD1 Opening balance (CTD) for the previous cycle
API_ACCOUNT_BALANCES.ABL_BAL_CTD1,ABL_BAL_CTD1 Posted balance (CTD) for the previous cycle
API_ACCOUNT_BALANCES.ABL_BAL_PD_CTD1,ABL_BAL_PD_CTD1 Balance paid(CTD) in the previous cycle
API_ACCOUNT_BALANCES.ABL_BAL_WAIVED_CTD1,ABL_BAL_WAIVED_CTD1 Balance waived (CTD) in the previous cycle
API_ACCOUNT_BALANCES.ABL_BAL_CHGOFF_OPEN_CTD1,ABL_BAL_CHGOFF_OPEN_CTD1 Opening Charged off balance (CTD) for the previous cycle
API_ACCOUNT_BALANCES.ABL_BAL_CHGOFF_CTD1,ABL_BAL_CHGOFF_CTD1 Charged off balance (CTD) for the previous cycle
API_ACCOUNT_BALANCES.ABL_BAL_RECOVERED_CTD1,ABL_BAL_RECOVERED_CTD1 Balance recovered (CTD) in the previous year
API_ACCOUNT_BALANCES.ABL_BAL_ADJUSTED_PLUS_CTD1,ABL_BAL_ADJUSTED_PLUS_CTD1 Positive adjustment balance (CTD) for the previous cycle
API_ACCOUNT_BALANCES.ABL_BAL_ADJUSTED_MINUS_CTD1,ABL_BAL_ADJUSTED_MINUS_CTD1 Negative adjustment balance (CTD) for the previous cycle
API_ACCOUNT_BALANCES.ABL_BAL_OPEN_YTD1,ABL_BAL_OPEN_YTD1 Opening balance (YTD) for the previous year
API_ACCOUNT_BALANCES.ABL_BAL_YTD1,ABL_BAL_YTD1 Posted balance (YTD) for the previous year
API_ACCOUNT_BALANCES.ABL_BAL_PD_YTD1,ABL_BAL_PD_YTD1 Balance paid(YTD) in the previous year
API_ACCOUNT_BALANCES.ABL_BAL_WAIVED_YTD1,ABL_BAL_WAIVED_YTD1 Balance waived (YTD) in the previous year
API_ACCOUNT_BALANCES.ABL_BAL_CHGOFF_OPEN_YTD1,ABL_BAL_CHGOFF_OPEN_YTD1 Opening Charged off balance (YTD) for the previous year
API_ACCOUNT_BALANCES.ABL_BAL_CHGOFF_YTD1,ABL_BAL_CHGOFF_YTD1 Charged off balance (YTD) for the previous year
API_ACCOUNT_BALANCES.ABL_BAL_RECOVERED_YTD1,ABL_BAL_RECOVERED_YTD1 Balance recovered (YTD) in the previous year
API_ACCOUNT_BALANCES.ABL_BAL_ADJUSTED_PLUS_YTD1,ABL_BAL_ADJUSTED_PLUS_YTD1 Positive adjustment balance (YTD) for the previous year
API_ACCOUNT_BALANCES.ABL_BAL_ADJUSTED_MINUS_YTD1,ABL_BAL_ADJUSTED_MINUS_YTD1 Negative adjustment balance (YTD) for the previous year
API_ACCOUNT_BALANCES.ABL_BILL_METHOD_CD,ABL_BILL_METHOD_CD Reference key to lookup billing method
API_ACCOUNT_BALANCES.ABL_PMT_AMT,ABL_PMT_AMT Promotional balance billing payment amount
API_ACCOUNT_BALANCES.ABL_PMT_PER,ABL_PMT_PER Promotional balance billing payment percentage
API_ACCOUNT_BALANCES_AMORTIZE.ABA_APP_ORIG_SYS_XREF,ABA_APP_ORIG_SYS_XREF External Reference Number
API_ACCOUNT_BALANCES_AMORTIZE.ABA_TXN_TYPE_CD1,ABA_TXN_TYPE_CD1 Amortize transaction type code 1
API_ACCOUNT_BALANCES_AMORTIZE.ABA_BAL1,ABA_BAL1 Total amount to be amortize for balance type 1
API_ACCOUNT_BALANCES_AMORTIZE.ABA_BAL_EARNED1,ABA_BAL_EARNED1 Amortize Amount earned for balance type 1
API_ACCOUNT_BALANCES_AMORTIZE.ABA_BAL_WRITEOFF1,ABA_BAL_WRITEOFF1 Amortize amount written-off for balance type 1
API_ACCOUNT_BALANCES_AMORTIZE.ABA_TXN_TYPE_CD2,ABA_TXN_TYPE_CD2 Amortize transaction type code 2
API_ACCOUNT_BALANCES_AMORTIZE.ABA_BAL2,ABA_BAL2 Total amount to be amortize for balance type 2
API_ACCOUNT_BALANCES_AMORTIZE.ABA_BAL_EARNED2,ABA_BAL_EARNED2 Amortize Amount earned for balance type 2
API_ACCOUNT_BALANCES_AMORTIZE.ABA_BAL_WRITEOFF2,ABA_BAL_WRITEOFF2 Amortize amount written-off for balance type 2
API_ACCOUNT_BALANCES_AMORTIZE.ABA_TXN_TYPE_CD3,ABA_TXN_TYPE_CD3 Amortize transaction type code 3
API_ACCOUNT_BALANCES_AMORTIZE.ABA_BAL3,ABA_BAL3 Total amount to be amortize for balance type 3
API_ACCOUNT_BALANCES_AMORTIZE.ABA_BAL_EARNED3,ABA_BAL_EARNED3 Amortize Amount earned for balance type 3
API_ACCOUNT_BALANCES_AMORTIZE.ABA_BAL_WRITEOFF3,ABA_BAL_WRITEOFF3 Amortize amount written-off for balance type 3
API_ACCOUNT_BALANCES_AMORTIZE.ABA_TXN_TYPE_CD4,ABA_TXN_TYPE_CD4 Amortize transaction type code 4
API_ACCOUNT_BALANCES_AMORTIZE.ABA_BAL4,ABA_BAL4 Total amount to be amortize for balance type 4
API_ACCOUNT_BALANCES_AMORTIZE.ABA_BAL_EARNED4,ABA_BAL_EARNED4 Amortize Amount earned for balance type 4
API_ACCOUNT_BALANCES_AMORTIZE.ABA_BAL_WRITEOFF4,ABA_BAL_WRITEOFF4 Amortize amount written-off for balance type 4
API_ACCOUNT_BALANCES_AMORTIZE.ABA_TXN_TYPE_CD5,ABA_TXN_TYPE_CD5 Amortize transaction type code 5
API_ACCOUNT_BALANCES_AMORTIZE.ABA_BAL5,ABA_BAL5 Total amount to be amortize for balance type 5
API_ACCOUNT_BALANCES_AMORTIZE.ABA_BAL_EARNED5,ABA_BAL_EARNED5 Amortize Amount earned for balance type 5
API_ACCOUNT_BALANCES_AMORTIZE.ABA_BAL_WRITEOFF5,ABA_BAL_WRITEOFF5 Amortize amount written-off for balance type 5
API_ACCOUNT_BALANCES_AMORTIZE.ABA_FASB_RATE1,ABA_FASB_RATE1 Interest rate for the FASB amortization calculation 1
API_ACCOUNT_BALANCES_AMORTIZE.ABA_FASB_BAL1,ABA_FASB_BAL1 Total FASB amortization balance 1
API_ACCOUNT_BALANCES_AMORTIZE.ABA_FASB_EFFECTIVE_BAL1,ABA_FASB_EFFECTIVE_BAL1 Total effective FASB amortization balance 1
API_ACCOUNT_BALANCES_AMORTIZE.ABA_FASB_RATE2,ABA_FASB_RATE2 Interest rate for the FASB amortization calculation 2
API_ACCOUNT_BALANCES_AMORTIZE.ABA_FASB_BAL2,ABA_FASB_BAL2 Total FASB amortization balance 2
API_ACCOUNT_BALANCES_AMORTIZE.ABA_FASB_EFFECTIVE_BAL2,ABA_FASB_EFFECTIVE_BAL2 Total effective FASB amortization balance 2
API_ACCOUNT_BALANCES_AMORTIZE.ABA_FASB_RATE3,ABA_FASB_RATE3 Interest rate for the FASB amortization calculation 3
API_ACCOUNT_BALANCES_AMORTIZE.ABA_FASB_BAL3,ABA_FASB_BAL3 Total FASB amortization balance 3
API_ACCOUNT_BALANCES_AMORTIZE.ABA_FASB_EFFECTIVE_BAL3,ABA_FASB_EFFECTIVE_BAL3 Total effective FASB amortization balance 3
API_ACCOUNT_BALANCES_AMORTIZE.ABA_AMORTIZE_FREQ_CD1,ABA_AMORTIZE_FREQ_CD1 Stores the amortization frequency -1 for the balance and it is used for converting accounts from other system
API_ACCOUNT_BALANCES_AMORTIZE.ABA_AMORTIZE_FREQ_CD2,ABA_AMORTIZE_FREQ_CD2 Stores the amortization frequency -2 for the balance and it is used for converting accounts from other system
API_ACCOUNT_BALANCES_AMORTIZE.ABA_AMORTIZE_FREQ_CD3,ABA_AMORTIZE_FREQ_CD3 Stores the amortization frequency -3 for the balance and it is used for converting accounts from other system
API_ACCOUNT_BALANCES_AMORTIZE.ABA_AMORTIZE_FREQ_CD4,ABA_AMORTIZE_FREQ_CD4 Stores the amortization frequency -4 for the balance and it is used for converting accounts from other system
API_ACCOUNT_BALANCES_AMORTIZE.ABA_AMORTIZE_FREQ_CD5,ABA_AMORTIZE_FREQ_CD5 Stores the amortization frequency -5 for the balance and it is used for converting accounts from other system
API_ACCOUNT_BALANCES_AMORTIZE.ABA_AMORTIZE_START_DT1,ABA_AMORTIZE_START_DT1 Stores the amortization start date -1 for the balance and it is used for converting accounts from other system
API_ACCOUNT_BALANCES_AMORTIZE.ABA_AMORTIZE_START_DT2,ABA_AMORTIZE_START_DT2 Stores the amortization start date -2 for the balance and it is used for converting accounts from other system
API_ACCOUNT_BALANCES_AMORTIZE.ABA_AMORTIZE_START_DT3,ABA_AMORTIZE_START_DT3 Stores the amortization start date -3 for the balance and it is used for converting accounts from other system
API_ACCOUNT_BALANCES_AMORTIZE.ABA_AMORTIZE_START_DT4,ABA_AMORTIZE_START_DT4 Stores the amortization start date -4 for the balance and it is used for converting accounts from other system
API_ACCOUNT_BALANCES_AMORTIZE.ABA_AMORTIZE_START_DT5,ABA_AMORTIZE_START_DT5 Stores the amortization start date -5 for the balance and it is used for converting accounts from other system
API_ACCOUNT_BALANCES_AMORTIZE.ABA_FIRST_AMORTIZE_DT1,ABA_FIRST_AMORTIZE_DT1 Stores the first amortization date-1 for the balance and it is used for converting accounts from other system
API_ACCOUNT_BALANCES_AMORTIZE.ABA_FIRST_AMORTIZE_DT2,ABA_FIRST_AMORTIZE_DT2 Stores the first amortization date-2 for the balance and it is used for converting accounts from other system
API_ACCOUNT_BALANCES_AMORTIZE.ABA_FIRST_AMORTIZE_DT3,ABA_FIRST_AMORTIZE_DT3 Stores the first amortization date-3 for the balance and it is used for converting accounts from other system
API_ACCOUNT_BALANCES_AMORTIZE.ABA_FIRST_AMORTIZE_DT4,ABA_FIRST_AMORTIZE_DT4 Stores the first amortization date-4 for the balance and it is used for converting accounts from other system
API_ACCOUNT_BALANCES_AMORTIZE.ABA_FIRST_AMORTIZE_DT5,ABA_FIRST_AMORTIZE_DT5 Stores the first amortization date-5 for the balance and it is used for converting accounts from other system
API_ACCOUNT_BALANCES_AMORTIZE.ABA_AMORTIZE_END_DT1,ABA_AMORTIZE_END_DT1 Stores the amortization end date -1 for the balance and it is used for converting accounts from other system
API_ACCOUNT_BALANCES_AMORTIZE.ABA_AMORTIZE_END_DT2,ABA_AMORTIZE_END_DT2 Stores the amortization end date -2 for the balance and it is used for converting accounts from other system
API_ACCOUNT_BALANCES_AMORTIZE.ABA_AMORTIZE_END_DT3,ABA_AMORTIZE_END_DT3 Stores the amortization end date -3 for the balance and it is used for converting accounts from other system
API_ACCOUNT_BALANCES_AMORTIZE.ABA_AMORTIZE_END_DT4,ABA_AMORTIZE_END_DT4 Stores the amortization end date -4 for the balance and it is used for converting accounts from other system
API_ACCOUNT_BALANCES_AMORTIZE.ABA_AMORTIZE_END_DT5,ABA_AMORTIZE_END_DT5 Stores the amortization end date -5 for the balance and it is used for converting accounts from other system
API_ACCOUNT_BALANCES_AMORTIZE.ABA_DT,ABA_DT Amortization Date
API_ACCOUNT_BALANCES_AMORTIZE.ABA_AMORTIZE_START_DT,ABA_AMORTIZE_START_DT Stores the date on which amortization of the balance should start
API_ACCOUNT_BALANCES_AMORTIZE.ABA_FIRST_AMORTIZE_DT,ABA_FIRST_AMORTIZE_DT Stores the first amortization date for the balance
API_ACCOUNT_BALANCES_AMORTIZE.CREATED_BY,CREATED_BY Standard Who
API_ACCOUNT_BALANCES_AMORTIZE.CREATION_DATE,CREATION_DATE Standard Who
API_TXNS.TXN_APP_ORIG_SYS_XREF,TXN_APP_ORIG_SYS_XREF Reference key to account id of legacy system
API_TXNS.TXN_SEQ,TXN_SEQ The transaction sequence number
API_TXNS.TXN_TCD_CODE,TXN_TCD_CODE Reference key to transaction
API_TXNS.TXN_REASON_CD,TXN_REASON_CD Reference key to lookup transaction reason
API_TXNS.TXN_MODE_CD,TXN_MODE_CD Reference key to lookup transaction mode
API_TXNS.TXN_REFERENCE,TXN_REFERENCE Reference information
API_TXNS.TXN_COMMENT,TXN_COMMENT The error reason or comment for transaction posting
API_TXNS.TXN_BALANCE_AMT,TXN_BALANCE_AMT The receivable balance after the posting of the current transaction
API_TXNS.TXN_POST_DT,TXN_POST_DT Date when the transaction was posted to the system
API_TXNS.TXN_DT,TXN_DT Transaction effective date
API_TXNS.TXN_AMT,TXN_AMT Transaction amount
API_TXNS.TXN_PMT_AMT,TXN_PMT_AMT New payment amount
API_TXNS.TXN_SPR_SPREAD,TXN_SPR_SPREAD Reference key to spread
API_TXNS.PAL_AMT_ADV,PAL_AMT_ADV The payment amount allocated to Advance balance
API_TXNS.PAL_AMT_INT,PAL_AMT_INT The payment amount allocated to Interest balance
API_TXNS.PAL_AMT_LC,PAL_AMT_LC The payment amount allocated to Late Charge Fee balance
API_TXNS.PAL_AMT_NSF,PAL_AMT_NSF The payment amount allocated to NSF Fee balance
API_TXNS.PAL_AMT_OVERAGE,PAL_AMT_OVERAGE The payment amount allocated to overage
API_TXNS.PAL_AMT_EXT,PAL_AMT_EXT The payment amount allocated to Extension Fee balance
API_TXNS.PAL_AMT_MEM,PAL_AMT_MEM The payment amount allocated to Membership Fee balance
API_TXNS.PAL_AMT_OVR,PAL_AMT_OVR The payment amount allocated to Overlimit Fee balance
API_TXNS.PAL_AMT_FADV,PAL_AMT_FADV The payment amount allocated to Advance Fee balance
API_TXNS.PAL_AMT_PPP,PAL_AMT_PPP The payment amount allocated to Pre Payment Penalty Fee balance
API_TXNS.PAL_AMT_OVR,PAL_AMT_OVR The payment amount allocated to Overlimit Fee balance
API_TXNS.PAL_AMT_PPP,PAL_AMT_PPP The payment amount allocated to Pre Payment Penalty Fee balance
API_TXNS.PAL_AMT_FADV,PAL_AMT_FADV The payment amount allocated to Advance Fee balance
API_TXNS.PAL_AMT_MEM,PAL_AMT_MEM The payment amount allocated to Membership Fee balance
API_TXNS.PAL_AMT_EXT,PAL_AMT_EXT The payment amount allocated to Extension Fee balance
API_TXNS.TXN_PMT_AMT,TXN_PMT_AMT New payment amount
API_TXNS.TXN_PRIMARY_IND,TXN_PRIMARY_IND Indicates whether the transaction is a primary transaction
API_TXNS.TXN_CURRENCY_AMT,TXN_CURRENCY_AMT Currency Transaction Amount
API_TXNS.TXN_CUR_CURRENCY_CODE,TXN_CUR_CURRENCY_CODE Reference key to Currency
API_TXNS.TXN_EXTN_TERM,TXN_EXTN_TERM New extension term
API_TXNS.TXN_DUE_DT,TXN_DUE_DT Due date of the billing transaction
API_TXNS.CREATED_BY,CREATED_BY Standard Who
API_TXNS.CREATION_DATE,CREATION_DATE Standard Who
API_COMMENTS.ACM_APP_ORIG_SYS_XREF,ACM_APP_ORIG_SYS_XREF Reference key to account comment of legacy system
API_COMMENTS.ACM_SEQ,ACM_SEQ Sequence number for account comment
API_COMMENTS.ACM_COMMENT,ACM_COMMENT A miscellaneous comment entered by the user
API_COMMENTS.ACM_COMMENT_DT,ACM_COMMENT_DT Account comment date
API_COMMENTS.ACM_COMMENT_BY,ACM_COMMENT_BY The name of the user entering and saving the comment
API_COMMENTS.ACM_COMMENT_TYPE_CD,ACM_COMMENT_TYPE_CD The type of the comment  such as REG - Regular and SYG - System Generated
API_COMMENTS.ACM_COMMENT_SUB_TYPE_CD,ACM_COMMENT_SUB_TYPE_CD The sub-type of the comment  such as ORG - Originations
API_COMMENTS.ACM_COMMENT_IMP_IND,ACM_COMMENT_IMP_IND Indicates if the comment is considered important
API_COMMENTS.ACM_ERROR_IND,ACM_ERROR_IND Error indicator for account comment
API_COMMENTS.CREATION_DATE,CREATION_DATE Standard Who
API_COMMENTS.CREATED_BY,CREATED_BY Standard Who
API_ACCOUNT_REPMT_SCHEDULE.ACP_APP_ORIG_SYS_XREF,ACP_APP_ORIG_SYS_XREF Reference key to application id of legacy system and it is used for converting accounts from other system
API_ACCOUNT_REPMT_SCHEDULE.ACP_SEQ,ACP_SEQ Sequence number for account repayment schedule and it is used for converting accounts from other system
API_ACCOUNT_REPMT_SCHEDULE.ACP_REPAYMENT_DT,ACP_REPAYMENT_DT Stores the payment date for repayment schedule and it is used for converting accounts from other system
API_ACCOUNT_REPMT_SCHEDULE.ACP_REPAYMENT_AMT,ACP_REPAYMENT_AMT Stores the payment amount for repayment schedule and it is used for converting accounts from other system
API_ACCOUNT_REPMT_SCHEDULE.ACP_NO_OF_PMTS,ACP_NO_OF_PMTS Stores the number of payments for repayment schedule and it is used for converting accounts from other system
API_ACCOUNT_REPMT_SCHEDULE.ACP_SYSTEM_GENERATED_IND,ACP_SYSTEM_GENERATED_IND Indicates if the payment in schedule is system generated and it is used for converting accounts from other system
API_ACCOUNT_REPMT_SCHEDULE.ACP_PRINCIPAL_AMT,ACP_PRINCIPAL_AMT Stores Interest Amount calculated
API_ACCOUNT_REPMT_SCHEDULE.ACP_INTEREST_AMT,ACP_INTEREST_AMT Stores Principal Amount calculated
API_ACCOUNT_REPMT_SCHEDULE.CREATED_BY,CREATED_BY Standard Who and it is used for converting accounts from other system
API_ACCOUNT_REPMT_SCHEDULE.CREATION_DATE,CREATION_DATE Standard Who and it is used for converting accounts from other system
API_ACCOUNT_RATE_SCHEDULE.ACR_APP_ORIG_SYS_XREF,ACR_APP_ORIG_SYS_XREF Reference key to application id of legacy system and it is used for converting accounts from other system
API_ACCOUNT_RATE_SCHEDULE.ACR_SEQ,ACR_SEQ Sequence Id for account rate change schedule and it is used for converting accounts from other system
API_ACCOUNT_RATE_SCHEDULE.ACR_RATE_CHG_FREQ_TYPE_CD,ACR_RATE_CHG_FREQ_TYPE_CD Reference key to lookup rate change frequency type and it is used for converting accounts from other system
API_ACCOUNT_RATE_SCHEDULE.ACR_RATE_CHG_PERIOD,ACR_RATE_CHG_PERIOD Stores the time or period between subsequent rate change based on rate adjustment frequency and it is used for converting accounts from other system
API_ACCOUNT_RATE_SCHEDULE.ACR_RATE_CHG_OCCURANCES,ACR_RATE_CHG_OCCURANCES The number of rate adjustments that should take place for particular frequency and it is used for converting accounts from other system
API_ACCOUNT_RATE_SCHEDULE.ACR_CURRENT_IND,ACR_CURRENT_IND Indicates the current rate change schedule being applied on account and it is used for converting accounts from other system
